,u_name,u_screen_name,t_date,t_text,t_polarity_score,t_polarity,t_subjectivity_score,u_followers,t_retweets,t_favorited,t_mentions
65,HealthTechInsider,HealthTechInsi2,16/03/2019,The @babylonhealth chatbot is “work in progress” but more worryingly not complying with very basic clinical safety protocols. The push in the market of this immature product is due to the need to keep blinding investors with the PR headlights. https://t.co/MDYCZGOTUx,0.125,Negative,0.3458333333333334,76,10,12,Babylon (babylonhealth)
66,Jim Parsons,JPWP,16/03/2019,"Alternately: @babylonhealth could intentionally be 💰 loosing cost centre. Sources of Personal Health Data for training #AI #Cloud #BigData Medical Systems:
a) hard to find
b) expensive
c) often static
Huge value in persistent, real-time, streams of personal health data for #AI https://t.co/m12Lv8fo2P",0.013541666666666667,Negative,0.45520833333333327,1264,1,0,Babylon (babylonhealth)
67,Jim Parsons,JPWP,16/03/2019,"As (or more) important:
DATA is an asset class
In event @babylonhealth goes bankrupt? 
—who owns personal health data citizens entered?
—what triggers patient data destruction?
—is receiver/liquidator auction block a path to global data-brokerage market?
 #HealthTech #AI #BigData https://t.co/m12Lv8fo2P",0.225,Neutral,0.45,1264,0,2,Babylon (babylonhealth)
68,Ben Furnival,ben_furnival,16/03/2019,Ought to try @babylonhealth if it’s available in your area. I usually get a video appointment in the following hour https://t.co/GHG0U96XLY,0.05000000000000001,Negative,0.25,2022,0,0,Babylon (babylonhealth)
69,Sandra Leaton Gray,drleatongray,16/03/2019,"Decided to buy Solvazinc to boost immune system. Online pharmacy said prescription only. Link took me to @babylonhealth, the disruptor firm for ££ private online GP appointments that @MattHancock hustles for. Only thing is, it’s an over the counter product. Misleading and dodgy.",-0.05,Negative,0.69375,2232,0,0,"Babylon (babylonhealth), Matt Hancock (MattHancock)"
70,Ian,IanStockport,16/03/2019,@sib313 @EinsteinsAttic @askmygp @DrMurphy11 @bengoldacre @doctorsdilemma @babylonhealth @GPatHand @ptaccesshelp @GPonlineservice @live_evergreen @getdoctorlink And many of these are forced to book an appointment at 8:30 on the day as by 8:40 they have all gone.,0.09999999999999998,Negative,0.35,104,1,2,"Steve the skeptic (sib313), Phil Booth (EinsteinsAttic), askmyGP (askmygp), Dr Murphy (DrMurphy11), ben goldacre (bengoldacre), Anil Adisesh (doctorsdilemma), Babylon (babylonhealth), Babylon GP at hand (GPatHand), Patient Access (ptaccesshelp), GP Online Services (GPonlineservice), Evergreen Life (live_evergreen), Doctorlink (getdoctorlink)"
71,JKM Care Solutions,JKMVidimo,16/03/2019,"@DrMurphy11 @doctorsdilemma @bengoldacre @babylonhealth @GPatHand @askmygp @ptaccesshelp @GPonlineservice @live_evergreen @getdoctorlink @MattHancock @JulietBauer @marcus_baw Struck a real chord with us too when first published. The frustration from many clinicians we've spoken with is palpable. Getting the Basics is clearly needed and yet, when this type of innovation presents itself, its met with stonewall silence or a plethora of excuses.",0.21000000000000002,Neutral,0.4033333333333333,476,2,2,"Dr Murphy (DrMurphy11), Anil Adisesh (doctorsdilemma), ben goldacre (bengoldacre), Babylon (babylonhealth), Babylon GP at hand (GPatHand), askmyGP (askmygp), Patient Access (ptaccesshelp), GP Online Services (GPonlineservice), Evergreen Life (live_evergreen), Doctorlink (getdoctorlink), Matt Hancock (MattHancock), Juliet Bauer (JulietBauer), Dr Marcus Baw (marcus_baw)"
72,Phil Booth,EinsteinsAttic,16/03/2019,@sib313 @askmygp @DrMurphy11 @bengoldacre @doctorsdilemma @babylonhealth @GPatHand @ptaccesshelp @GPonlineservice @live_evergreen @getdoctorlink Ta. Will do.,0.0,Negative,0.0,1067,0,0,"Steve the skeptic (sib313), askmyGP (askmygp), Dr Murphy (DrMurphy11), ben goldacre (bengoldacre), Anil Adisesh (doctorsdilemma), Babylon (babylonhealth), Babylon GP at hand (GPatHand), Patient Access (ptaccesshelp), GP Online Services (GPonlineservice), Evergreen Life (live_evergreen), Doctorlink (getdoctorlink)"
73,Navin Chandra,nav4879,16/03/2019,Does anyone have videos of @babylonhealth getting it right....? 🤦🏽‍♂️🤔🙏🏽 https://t.co/4bIPQ011bh,0.2857142857142857,Neutral,0.5357142857142857,799,0,1,Babylon (babylonhealth)
74,Steve the skeptic,sib313,16/03/2019,@EinsteinsAttic @askmygp @DrMurphy11 @bengoldacre @doctorsdilemma @babylonhealth @GPatHand @ptaccesshelp @GPonlineservice @live_evergreen @getdoctorlink Nationally only ~40-45% of patients get same day appointments. See previous tweets of mine on NHS Digital’s GP appointment data.,-0.041666666666666664,Negative,0.3229166666666667,1844,1,0,"Phil Booth (EinsteinsAttic), askmyGP (askmygp), Dr Murphy (DrMurphy11), ben goldacre (bengoldacre), Anil Adisesh (doctorsdilemma), Babylon (babylonhealth), Babylon GP at hand (GPatHand), Patient Access (ptaccesshelp), GP Online Services (GPonlineservice), Evergreen Life (live_evergreen), Doctorlink (getdoctorlink)"
75,ben goldacre,bengoldacre,16/03/2019,@askmygp @sib313 @DrMurphy11 @doctorsdilemma @babylonhealth @GPatHand @ptaccesshelp @GPonlineservice @live_evergreen @getdoctorlink That is well interesting.,0.5,Neutral,0.5,482398,0,1,"askmyGP (askmygp), Steve the skeptic (sib313), Dr Murphy (DrMurphy11), Anil Adisesh (doctorsdilemma), Babylon (babylonhealth), Babylon GP at hand (GPatHand), Patient Access (ptaccesshelp), GP Online Services (GPonlineservice), Evergreen Life (live_evergreen), Doctorlink (getdoctorlink)"
76,Phil Booth,EinsteinsAttic,16/03/2019,@sib313 @askmygp @DrMurphy11 @bengoldacre @doctorsdilemma @babylonhealth @GPatHand @ptaccesshelp @GPonlineservice @live_evergreen @getdoctorlink That looks impressive! Do you have comparative analytics for practices using other methods?,0.4375,Neutral,0.6875,1067,0,1,"Steve the skeptic (sib313), askmyGP (askmygp), Dr Murphy (DrMurphy11), ben goldacre (bengoldacre), Anil Adisesh (doctorsdilemma), Babylon (babylonhealth), Babylon GP at hand (GPatHand), Patient Access (ptaccesshelp), GP Online Services (GPonlineservice), Evergreen Life (live_evergreen), Doctorlink (getdoctorlink)"
77,askmyGP,askmygp,16/03/2019,@sib313 @DrMurphy11 @bengoldacre @doctorsdilemma @babylonhealth @GPatHand @ptaccesshelp @GPonlineservice @live_evergreen @getdoctorlink The tiny take up of video by both patients and clinicians has been a real surprise to us.,0.1,Negative,0.4,1003,0,0,"Steve the skeptic (sib313), Dr Murphy (DrMurphy11), ben goldacre (bengoldacre), Anil Adisesh (doctorsdilemma), Babylon (babylonhealth), Babylon GP at hand (GPatHand), Patient Access (ptaccesshelp), GP Online Services (GPonlineservice), Evergreen Life (live_evergreen), Doctorlink (getdoctorlink)"
78,Steve the skeptic,sib313,16/03/2019,"@askmygp @DrMurphy11 @bengoldacre @doctorsdilemma @babylonhealth @GPatHand @ptaccesshelp @GPonlineservice @live_evergreen @getdoctorlink Also askmyGP offers patients video as a way to talk to their GP. Fewer than 1 in 1,000 patients choose it over simple online messages or phone calls.",0.05,Negative,0.17857142857142858,1844,1,6,"askmyGP (askmygp), Dr Murphy (DrMurphy11), ben goldacre (bengoldacre), Anil Adisesh (doctorsdilemma), Babylon (babylonhealth), Babylon GP at hand (GPatHand), Patient Access (ptaccesshelp), GP Online Services (GPonlineservice), Evergreen Life (live_evergreen), Doctorlink (getdoctorlink)"
79,Steve the skeptic,sib313,16/03/2019,"@askmygp @DrMurphy11 @bengoldacre @doctorsdilemma @babylonhealth @GPatHand @ptaccesshelp @GPonlineservice @live_evergreen @getdoctorlink For example, this is how fast askmyGP practices respond to patient requests: https://t.co/BZnRTVuNXP",0.2,Negative,0.6,1844,2,3,"askmyGP (askmygp), Dr Murphy (DrMurphy11), ben goldacre (bengoldacre), Anil Adisesh (doctorsdilemma), Babylon (babylonhealth), Babylon GP at hand (GPatHand), Patient Access (ptaccesshelp), GP Online Services (GPonlineservice), Evergreen Life (live_evergreen), Doctorlink (getdoctorlink)"
80,Meddev Guy,Meddev_guy,16/03/2019,@DrMurphy11 @MHRAdevices @babylonhealth @GPatHand @MattHancock @TELUSHealth @Samsung @DMS_MilMed @CareQualityComm @bengoldacre @NHSCCIO You need to report via Yellow Card. https://t.co/bO2z4gr89C,0.0,Negative,0.0,9,0,0,"Dr Murphy (DrMurphy11), MHRA Devices Safety (MHRAdevices), Babylon (babylonhealth), Babylon GP at hand (GPatHand), Matt Hancock (MattHancock), TELUS Health (TELUSHealth), Samsung Electronics (Samsung), Defence Medical Services (DMS_MilMed), Care Quality Commission (CareQualityComm), ben goldacre (bengoldacre), Simon Eccles (NHSCCIO)"
81,askmyGP,askmygp,16/03/2019,@DrMurphy11 @bengoldacre @doctorsdilemma @babylonhealth @GPatHand @ptaccesshelp @GPonlineservice @live_evergreen @getdoctorlink @sib313 has the analytics.,0.0,Negative,0.0,1003,0,1,"Dr Murphy (DrMurphy11), ben goldacre (bengoldacre), Anil Adisesh (doctorsdilemma), Babylon (babylonhealth), Babylon GP at hand (GPatHand), Patient Access (ptaccesshelp), GP Online Services (GPonlineservice), Evergreen Life (live_evergreen), Doctorlink (getdoctorlink), Steve the skeptic (sib313)"
82,askmyGP,askmygp,16/03/2019,"@DrMurphy11 @bengoldacre @doctorsdilemma @babylonhealth @GPatHand @ptaccesshelp @GPonlineservice @live_evergreen @getdoctorlink For the record, we serve over 300,000 NHS patients through their practices.  We managed 15,000 consults last week, of which 10,000 initiated online, video offered alongside other channels.  Some fascinating evidence emerging.",0.19166666666666665,Negative,0.4305555555555556,1003,2,3,"Dr Murphy (DrMurphy11), ben goldacre (bengoldacre), Anil Adisesh (doctorsdilemma), Babylon (babylonhealth), Babylon GP at hand (GPatHand), Patient Access (ptaccesshelp), GP Online Services (GPonlineservice), Evergreen Life (live_evergreen), Doctorlink (getdoctorlink)"
83,Dr Murphy,DrMurphy11,16/03/2019,"@bengoldacre @doctorsdilemma @babylonhealth @GPatHand @askmygp @ptaccesshelp @GPonlineservice @live_evergreen @getdoctorlink Apologies @bengoldacre; it was an emotive tweet, driven by the indifference that has been shown by those responsible for #HealthTech #Governance &amp; #PatientSafety.

I wasn't present at the event, what other online GP consultation systems got a mention? https://t.co/eDLDQBDXHy",0.025000000000000005,Negative,0.30833333333333335,4083,0,1,"ben goldacre (bengoldacre), Anil Adisesh (doctorsdilemma), Babylon (babylonhealth), Babylon GP at hand (GPatHand), askmyGP (askmygp), Patient Access (ptaccesshelp), GP Online Services (GPonlineservice), Evergreen Life (live_evergreen), Doctorlink (getdoctorlink), ben goldacre (bengoldacre)"
84,S P P Whiteley,WhiteAero,16/03/2019,"@DrMurphy11 @MHRAdevices @babylonhealth @GPatHand @MattHancock @TELUSHealth @Samsung @DMS_MilMed @CareQualityComm @bengoldacre @NHSCCIO Hi, has a response time been given on when they will respond, given that this is a #PatientSafety issue? Have they also been contacted verbally / physically to ensure they know this issue needs urgent consideration?
Thank you",0.0,Negative,0.14285714285714285,2049,1,3,"Dr Murphy (DrMurphy11), MHRA Devices Safety (MHRAdevices), Babylon (babylonhealth), Babylon GP at hand (GPatHand), Matt Hancock (MattHancock), TELUS Health (TELUSHealth), Samsung Electronics (Samsung), Defence Medical Services (DMS_MilMed), Care Quality Commission (CareQualityComm), ben goldacre (bengoldacre), Simon Eccles (NHSCCIO)"
85,ben goldacre,bengoldacre,16/03/2019,"@DrMurphy11 @doctorsdilemma @babylonhealth @GPatHand @askmygp @ptaccesshelp @GPonlineservice @live_evergreen @getdoctorlink That piece has a random quote from an LMC event I chaired. I expressed various views, in passing. It is absurd/unprofessional of you to anonymously characterise this as me ""promoting"" a company. I have mixed, critical views on Babylon - and the state's response to it - as before.",-0.125,Negative,0.5125,482398,1,3,"Dr Murphy (DrMurphy11), Anil Adisesh (doctorsdilemma), Babylon (babylonhealth), Babylon GP at hand (GPatHand), askmyGP (askmygp), Patient Access (ptaccesshelp), GP Online Services (GPonlineservice), Evergreen Life (live_evergreen), Doctorlink (getdoctorlink)"
86,TAcademic,taphc,16/03/2019,@DrMurphy11 @bengoldacre The problem with @babylonhealth company is more concerned about profits rather than safety - ie keeping a flawed chatbot and GPathand only registering well patients - it seems it's a company that has very little to do with health*care* and more to do with profit generation,0.05125,Negative,0.63,13,0,1,"Dr Murphy (DrMurphy11), ben goldacre (bengoldacre), Babylon (babylonhealth)"
87,ben goldacre,bengoldacre,16/03/2019,"@DrMurphy11 @babylonhealth @BadBotThreads I haven't made any ""statement"" to ""qualify"". I have mixed, critical views on Babylon - and the state's response to it - as before. That piece has one random quote from an LMC event I chaired. I expressed various views, in passing. Not sure your lurid denunciations are helpful.",-0.15,Negative,0.5877777777777777,482398,0,0,"Dr Murphy (DrMurphy11), Babylon (babylonhealth), BadBotThreads (BadBotThreads)"
88,Dr Murphy,DrMurphy11,16/03/2019,"This tumblr post👇

https://t.co/IdabUHQNSR

contains recent email correspondence with @MHRAdevices, relating to the dangerously flawed @babylonhealth #eHealth Chatbot.

The inactivity of those with responsibility for Healthcare #PatientSafety &amp; #Governance; is inexcusable. https://t.co/jUS2LAoXtt",-0.25,Negative,0.375,4083,11,12,"MHRA Devices Safety (MHRAdevices), Babylon (babylonhealth)"
89,david,davidecarroll,16/03/2019,yet more first rate diagnosing from @babylonhealth 😂 https://t.co/x0J9JZA7Cr,0.375,Neutral,0.41666666666666663,1928,0,2,Babylon (babylonhealth)
90,Dr Murphy,DrMurphy11,16/03/2019,"@doctorsdilemma @bengoldacre @babylonhealth @GPatHand @askmygp @ptaccesshelp @GPonlineservice @live_evergreen @getdoctorlink @MattHancock @JulietBauer This blog by @marcus_baw is eye-opening &amp; helps explain ""why we have no actual innovation, just bullshitters retweeting each other about a vague fantasy Blockchain &amp; AI future, while the NHS burns for lack of basic functionality."" https://t.co/qaXEaQcnXV",-0.125,Negative,0.24500000000000002,4083,5,7,"Anil Adisesh (doctorsdilemma), ben goldacre (bengoldacre), Babylon (babylonhealth), Babylon GP at hand (GPatHand), askmyGP (askmygp), Patient Access (ptaccesshelp), GP Online Services (GPonlineservice), Evergreen Life (live_evergreen), Doctorlink (getdoctorlink), Matt Hancock (MattHancock), Juliet Bauer (JulietBauer), Dr Marcus Baw (marcus_baw)"
91,Jim Parsons,JPWP,15/03/2019,"Speaking of innovation Bro’s — @babylonhealth’s revolutionary, world changing, health #chatbot now brought to you by the good folks at a Canadian phone company! 😞 @telus @TELUSHealth (only available in British Columbia) / cc: @marcus_baw https://t.co/wdsjpKNpXu",0.31875,Neutral,0.5,1264,0,3,"Babylon (babylonhealth), TELUS (TELUS), TELUS Health (TELUSHealth), Dr Marcus Baw (marcus_baw)"
92,💥M💥,MatSilk,15/03/2019,"@noodleflute @DrMurphy11 @babylonhealth Ha - join the club, I got tuberculosis (maybe taken my Victorian Literature degree into account?)",0.0,Negative,0.0,422,1,3,"Anita Brien (noodleflute), Dr Murphy (DrMurphy11), Babylon (babylonhealth)"
93,Jim Parsons,JPWP,15/03/2019,"Wondering how much malaria @telushealth @telus @babylonhealth algorithms will diagnose in beautiful British Columbia, Canada #DigitalHealth #Health #AI #BioSurveillance #EthicalAnalytics https://t.co/9YhzRUgaj8",0.35000000000000003,Neutral,0.39999999999999997,1264,2,3,"TELUS Health (TELUSHealth), TELUS (TELUS), Babylon (babylonhealth)"
94,Anil Adisesh,doctorsdilemma,15/03/2019,"@askmygp @DrMurphy11 @bengoldacre @babylonhealth @GPatHand @ptaccesshelp @GPonlineservice @live_evergreen @getdoctorlink @MattHancock @JulietBauer My comment wasn’t aimed at your product, like I said I’ve never heard of it so no need to @me",0.0,Negative,0.0,509,0,1,"askmyGP (askmygp), Dr Murphy (DrMurphy11), ben goldacre (bengoldacre), Babylon (babylonhealth), Babylon GP at hand (GPatHand), Patient Access (ptaccesshelp), GP Online Services (GPonlineservice), Evergreen Life (live_evergreen), Doctorlink (getdoctorlink), Matt Hancock (MattHancock), Juliet Bauer (JulietBauer), Maine.com (Me)"
95,askmyGP,askmygp,15/03/2019,"@doctorsdilemma @DrMurphy11 @bengoldacre @babylonhealth @GPatHand @ptaccesshelp @GPonlineservice @live_evergreen @getdoctorlink @MattHancock @JulietBauer You are welcome to advise us on #MarketingStrategy but in short, we don't promote to general public as we only serve patients registered at customer practices.  And promoting to GPs is, er, problematic.  £millions on PR is what VC backers want, not appropriate for other models.",0.06785714285714287,Negative,0.5202380952380953,1003,0,1,"Anil Adisesh (doctorsdilemma), Dr Murphy (DrMurphy11), ben goldacre (bengoldacre), Babylon (babylonhealth), Babylon GP at hand (GPatHand), Patient Access (ptaccesshelp), GP Online Services (GPonlineservice), Evergreen Life (live_evergreen), Doctorlink (getdoctorlink), Matt Hancock (MattHancock), Juliet Bauer (JulietBauer)"
96,Anita Brien,noodleflute,15/03/2019,"So I’ve been unwell for a few days - dizziness, lethargy, fainting....just did a @babylonhealth symptom checker and apparently there is a 75% chance I have malaria! #babylonhealth #misdiagnosis https://t.co/bhl4WIFAFa",-0.06875,Negative,0.22499999999999998,272,19,50,Babylon (babylonhealth)
97,Anil Adisesh,doctorsdilemma,15/03/2019,"@DrMurphy11 @bengoldacre @babylonhealth @GPatHand @askmygp @ptaccesshelp @GPonlineservice @live_evergreen @getdoctorlink @MattHancock @JulietBauer But neither have the general public, #MarketingStrategy",0.02500000000000001,Negative,0.2833333333333333,509,0,0,"Dr Murphy (DrMurphy11), ben goldacre (bengoldacre), Babylon (babylonhealth), Babylon GP at hand (GPatHand), askmyGP (askmygp), Patient Access (ptaccesshelp), GP Online Services (GPonlineservice), Evergreen Life (live_evergreen), Doctorlink (getdoctorlink), Matt Hancock (MattHancock), Juliet Bauer (JulietBauer)"
98,Dr Murphy,DrMurphy11,15/03/2019,"@doctorsdilemma @bengoldacre @babylonhealth @GPatHand @askmygp @ptaccesshelp @GPonlineservice @live_evergreen @getdoctorlink The reason you haven't heard of the other 22 NHS Approved online providers; is because they haven't spent millions on 'Hyperbolic PR' or been promoted by @MattHancock @JulietBauer or @bengoldacre... #Integrity #Transparency #COIs 
https://t.co/VlgfQU8jpd",-0.1125,Negative,0.2375,4083,2,5,"Anil Adisesh (doctorsdilemma), ben goldacre (bengoldacre), Babylon (babylonhealth), Babylon GP at hand (GPatHand), askmyGP (askmygp), Patient Access (ptaccesshelp), GP Online Services (GPonlineservice), Evergreen Life (live_evergreen), Doctorlink (getdoctorlink), Matt Hancock (MattHancock), Juliet Bauer (JulietBauer), ben goldacre (bengoldacre)"
99,Anil Adisesh,doctorsdilemma,15/03/2019,"@DrMurphy11 @bengoldacre @babylonhealth @GPatHand @askmygp @ptaccesshelp @GPonlineservice @live_evergreen @getdoctorlink I can see your point although the others haven’t really impinged upon general awareness much, I’d struggle to name them. I remember an ex NHS digital innovation chief going to work for a Scandinavian one something like lyft but that’s a taxi app",0.1125,Negative,0.22499999999999998,509,1,1,"Dr Murphy (DrMurphy11), ben goldacre (bengoldacre), Babylon (babylonhealth), Babylon GP at hand (GPatHand), askmyGP (askmygp), Patient Access (ptaccesshelp), GP Online Services (GPonlineservice), Evergreen Life (live_evergreen), Doctorlink (getdoctorlink)"
100,Dr Murphy,DrMurphy11,15/03/2019,"@doctorsdilemma @bengoldacre @babylonhealth What's disappointing, is that @bengoldacre has used 'his position' to promote Babylon @GPatHand, when there are many alternative 'non-disruptive' online solutions available... 
@askmygp @ptaccesshelp @GPonlineservice @live_evergreen @getdoctorlink  https://t.co/57n0G6DaV0",0.10000000000000002,Negative,0.5333333333333333,4083,2,5,"Anil Adisesh (doctorsdilemma), ben goldacre (bengoldacre), Babylon (babylonhealth), ben goldacre (bengoldacre), Babylon GP at hand (GPatHand), askmyGP (askmygp), Patient Access (ptaccesshelp), GP Online Services (GPonlineservice), Evergreen Life (live_evergreen), Doctorlink (getdoctorlink)"
101,Anil Adisesh,doctorsdilemma,15/03/2019,@DrMurphy11 @bengoldacre @bengoldacre is absolutely right note he’s talking about accessible video consultation (not AI chatbots) and where was all the UK ehealth discussion before @babylonhealth market entry. The paradigm shift is important. #eHealth,0.3535714285714286,Neutral,0.6369047619047619,509,1,1,"Dr Murphy (DrMurphy11), ben goldacre (bengoldacre), ben goldacre (bengoldacre), Babylon (babylonhealth)"
102,Dr Murphy,DrMurphy11,15/03/2019,"You need to qualify that statement, or delete some of your prior tweets...

There is nothing 'novel' or 'innovative' about @babylonhealth apart from their Hyperbolic PR.

Why are you suddenly promoting Bad HealthTech?
@BadBotThreads #DeathByChatbot 
https://t.co/cTQqG3CgnW",-0.04999999999999996,Negative,0.5416666666666666,4083,6,13,"Babylon (babylonhealth), BadBotThreads (BadBotThreads)"
103,Dr Keith Grimes,keithgrimes,15/03/2019,We've seen great benefit from the work of @babylrwanda in Rwanda using #DigitalHealth and feature phone tech #foim19 @babylonhealth,0.8,Positive,0.75,5520,0,1,"babyl Rwanda (babylrwanda), Babylon (babylonhealth)"
104,Dr Murphy,DrMurphy11,15/03/2019,"@keithgrimes I have no problem with Dr Zhang &amp; his Peer Reviewed 'AI' HealthTech research.

The Quackery is your inclusion of @babylonhealth within the tweet.

Babylon's 'AI' Chatbot, is an embarrassment to the field of 'Artificial Intelligence'.
https://t.co/fk9ISeE7sY",-0.6,Negative,1.0,4083,0,1,"Dr Keith Grimes (keithgrimes), Babylon (babylonhealth)"
105,WhatsYourTech,whatsyourtech,15/03/2019,"Healthcare by Smartphone in British Columbia @TELUSHealth , @babylonhealth, , @jyetman , @GPatHand,  #babylonhealth,  https://t.co/qMqJiMTDWn https://t.co/JO80TiRk1C",0.0,Negative,0.0,4104,0,2,"TELUS Health (TELUSHealth), Babylon (babylonhealth), Jill Yetman (jyetman), Babylon GP at hand (GPatHand)"
106,WhatsYourTech,whatsyourtech,15/03/2019,"Healthcare by Smartphone in British Columbia @TELUSHealth , @babylonhealth, @TELUS , @TELUSBusiness , @bchealthnews , @BC_HC , @BCCareProviders , #babylonhealth, @GPatHand https://t.co/qMqJiMTDWn https://t.co/A6fdPA8zwd",0.0,Negative,0.0,4104,0,0,"TELUS Health (TELUSHealth), Babylon (babylonhealth), TELUS (TELUS), TELUS Business (TELUSBusiness), BC Health News (bchealthnews), BCHealthyCommunities (BC_HC), BC Care Providers (BCCareProviders), Babylon GP at hand (GPatHand)"
107,Dr Keith Grimes,keithgrimes,15/03/2019,"Dr Zhang talking about the use of their Deep Learning Paediatric AI to provide symptom checking and triage for global use, and supporting clinicians. Incredible to see the pace of progress in this area! @babylonhealth #FOIM19",0.3125,Neutral,0.3875,5520,0,1,Babylon (babylonhealth)
108,"yes, like the writer",msjaneaustin,15/03/2019,I ran a pub quiz with the team @babylonhealth and the final round we watched the video for Lionel Ritchie’s Hello then had to recreate the Lionel sculpture from memory. Here are the results https://t.co/VaKh4tiMDd,-0.1,Negative,0.7,3621,0,9,Babylon (babylonhealth)
109,James Law,drjameslaw,15/03/2019,"Rubbish. Name these corners @MattHancock and give us examples. Or maybe @babylonhealth diagnosed them for you?! 

Please stop spreading lies. Any chance we could have a #HealthSecretary who wants to nurture rather than destroy the NHS? https://t.co/mjZhxeUWGY",0.0,Negative,0.05,513,0,0,"Matt Hancock (MattHancock), Babylon (babylonhealth)"
110,Jack R,86JAR,14/03/2019,@GeorgeDigitalDr @DrSelvarajah @DrMurphy11 @babylonhealth @GPatHand That Fulham PCN is going to be the biggest in the country by miles.,0.0,Negative,0.0,79,0,0,"Georgedigitaldoctor (GeorgeDigitalDr), Selvaseelan Selvarajah (DrSelvarajah), Dr Murphy (DrMurphy11), Babylon (babylonhealth), Babylon GP at hand (GPatHand)"
111,Jack R,86JAR,14/03/2019,"@sib313 @Cath_Read @missdaykes @doctor_oxford @babylonhealth @MattHancock @NHSEngland @CQCProf @didoharding Not if you live in Suffolk, it doesn't. Not unless you want to travel to London",0.13636363636363635,Negative,0.5,79,0,0,"Steve the skeptic (sib313), Catherine Read (Cath_Read), Jil Stein (missdaykes), Rachel Clarke (doctor_oxford), Babylon (babylonhealth), Matt Hancock (MattHancock), NHS England (NHSEngland), CQCProf (CQCProf), dido harding (didoharding)"
112,Jack R,86JAR,14/03/2019,"@doctor_oxford @babylonhealth @MattHancock @NHSEngland @CQCProf @didoharding She urgently needs to get herself over from Suffolk to see her GP in Fulham, who can then refer her to her local hospital in Suffolk...",0.0,Negative,0.0,79,0,0,"Rachel Clarke (doctor_oxford), Babylon (babylonhealth), Matt Hancock (MattHancock), NHS England (NHSEngland), CQCProf (CQCProf), dido harding (didoharding)"
113,Maggie Babb,margaret_babb,14/03/2019,@radiology_grump @DrMurphy11 @ShaunLintern @MattHancock @babylonhealth Which in itself requires quite significant skill,0.375,Neutral,0.875,96,0,4,"Dr Radiology Grump (radiology_grump), Dr Murphy (DrMurphy11), Shaun Lintern (ShaunLintern), Matt Hancock (MattHancock), Babylon (babylonhealth)"
114,Jeremy Hoare,TopTVCameraman,14/03/2019,#Tory MP sponsored by @babylonhealth - not to be trusted. https://t.co/Y9kJQJwh0m,0.0,Negative,0.0,1104,0,0,Babylon (babylonhealth)
115,WyeValleyGeriatricMedicine,ValleyWye,14/03/2019,@radiology_grump @ShaunLintern @MattHancock @babylonhealth Jeremy hunt was saying some sensible things on patient safety and bawa garba by the end. Health sec is a very hard job.,-0.23958333333333337,Negative,0.6520833333333333,185,0,0,"Dr Radiology Grump (radiology_grump), Shaun Lintern (ShaunLintern), Matt Hancock (MattHancock), Babylon (babylonhealth)"
